{
  "schema_version": "1.0",
  "case_id": "notes-orion-path-indexed",
  "suite_id": "tier0-golden",
  "tier": "tier0",
  "corpus_id": "tier0.local_fs",
  "title": "Nested path-filtered note search (indexed backend)",
  "description": "Search for Orion within the archived notes subtree.",
  "query": {
    "text": "Orion checklist",
    "syntax": "literal",
    "case_sensitivity": "smart",
    "path_globs_include": [
      "docs/notes/**"
    ],
    "max_results": 5
  },
  "run_mode": {
    "provider_mode": "local_fs",
    "manifest_state": "warm",
    "content_cache_state": "not_applicable",
    "backend_mode": "enabled"
  },
  "expected_results": {
    "judgment_file": "benchmarks/judgments/tier0/local_fs_golden.json",
    "judgment_case_id": "notes-orion-path",
    "requires_complete_coverage": true
  }
}
