{
  "schema_version": "1.0",
  "case_id": "log-tenant-alpha-regex-indexed",
  "suite_id": "tier0-golden",
  "tier": "tier0",
  "corpus_id": "tier0.local_fs",
  "title": "Regex match in log file (indexed backend)",
  "description": "Use a regex query to find the tenant alpha ingestion log line.",
  "query": {
    "text": "tenant\\s+alpha",
    "syntax": "regex",
    "case_sensitivity": "smart",
    "path_globs_include": [
      "docs/logs/**"
    ],
    "max_results": 5
  },
  "run_mode": {
    "provider_mode": "local_fs",
    "manifest_state": "warm",
    "content_cache_state": "not_applicable",
    "backend_mode": "enabled"
  },
  "expected_results": {
    "judgment_file": "benchmarks/judgments/tier0/local_fs_golden.json",
    "judgment_case_id": "log-tenant-alpha-regex",
    "requires_complete_coverage": true
  }
}
